{
  "$schema": "http://json-schema.org/draft-04/schema#",
  "type": "object",
  "properties": {
    "uploadId": {
      "$ref": "#/definitions/uuid"
    },
    "headerFileReference": {
      "$ref": "#/definitions/uuid"
    },
    "headerFilename": {
      "type": "string"
    },
    "offenceFileReference": {
      "$ref": "#/definitions/uuid"
    },
    "offenceFilename": {
      "type": "string"
    },
    "timestamp": {
      "type": "string",
      "format": "date-time"
    }
  },
  "required": [
    "uploadId",
    "headerFileReference",
    "headerFilename",
    "offenceFileReference",
    "offenceFilename",
    "timestamp"
  ],
  "definitions": {
    "uuid": {
      "type": "string",
      "pattern": "^[a-fA-F0-9]{8}-[a-fA-F0-9]{4}-[a-fA-F0-9]{4}-[a-fA-F0-9]{4}-[a-fA-F0-9]{12}$"
    }
  }
}