{
  "uploadId": "b2569c8a-2deb-3578-82a3-2d2b6cd79fcb",
  "headerFileReference": "a9569c8a-2deb-4578-82a3-2d2b6cd79fee",
  "headerFilename": "header.csv",
  "offenceFileReference": "e4569c8d-2deb-4578-82a3-2d2b6cd59fe3",
  "offenceFilename": "offence.csv",
  "timestamp": "2016-12-16T13:47:01.115Z"
}